{
  "version": "0.4.0",
  "description": "Canonical Periodic Table of Software Elements. Finite building blocks for compositional application development and LLM code generation.",
  "families": [
    {
      "id": "objects",
      "name": "Objects (Nouns)",
      "description": "Core entities and domain nouns that systems are built around.",
      "range": [1, 35]
    },
    {
      "id": "properties",
      "name": "Properties (Attributes)",
      "description": "Fields, types, and metadata that describe objects.",
      "range": [36, 60]
    },
    {
      "id": "actions",
      "name": "Actions (Verbs)",
      "description": "Operations that can be performed on objects or by the system.",
      "range": [61, 85]
    },
    {
      "id": "interfaces",
      "name": "Interfaces (Views)",
      "description": "Presentation and interaction surfaces.",
      "range": [86, 100]
    },
    {
      "id": "intelligence",
      "name": "Intelligence (AI)",
      "description": "Cognitive and generative primitives.",
      "range": [101, 108]
    },
    {
      "id": "rules",
      "name": "Rules (Automation)",
      "description": "Governance, triggers, conditions, and audit mechanisms.",
      "range": [109, 115]
    }
  ],
  "elements": [
    {"id": 1, "symbol": "Co", "name": "Company", "family": "objects", "description": "Organization or legal entity.", "composesWith": ["Ct", "Ac", "In"]},
    {"id": 2, "symbol": "Pe", "name": "Person", "family": "objects", "description": "Human individual.", "composesWith": ["Ct", "Us"]},
    {"id": 3, "symbol": "Ct", "name": "Contact", "family": "objects", "description": "Reachable person or entity record.", "composesWith": ["Co", "Ay"]},
    {"id": 4, "symbol": "Ld", "name": "Lead", "family": "objects", "description": "Potential customer or opportunity source.", "composesWith": ["Dl", "Op"]},
    {"id": 5, "symbol": "Dl", "name": "Deal", "family": "objects", "description": "Sales opportunity or negotiated agreement.", "composesWith": ["Ld", "In"]},
    {"id": 6, "symbol": "Ac", "name": "Account", "family": "objects", "description": "Customer or organizational account.", "composesWith": ["Co", "Us", "Su"]},
    {"id": 7, "symbol": "Us", "name": "User", "family": "objects", "description": "Authenticated system user.", "composesWith": ["Ro", "Tm"]},
    {"id": 8, "symbol": "Tm", "name": "Team", "family": "objects", "description": "Group of users with shared context.", "composesWith": ["Us", "Ro"]},
    {"id": 9, "symbol": "Ro", "name": "Role", "family": "objects", "description": "Named set of permissions or responsibilities.", "composesWith": ["Us", "Pn"]},
    {"id": 10, "symbol": "Op", "name": "Opportunity", "family": "objects", "description": "Business opportunity.", "composesWith": ["Ld", "Dl"]},
    {"id": 11, "symbol": "Pr", "name": "Product", "family": "objects", "description": "Sellable or deliverable product.", "composesWith": ["Cu", "Tg"]},
    {"id": 12, "symbol": "Sv", "name": "Service", "family": "objects", "description": "Deliverable service offering.", "composesWith": ["Pr", "Px"]},
    {"id": 13, "symbol": "Pj", "name": "Project", "family": "objects", "description": "Time-bounded body of work.", "composesWith": ["Tk", "Tm"]},
    {"id": 14, "symbol": "Tk", "name": "Task", "family": "objects", "description": "Unit of work.", "composesWith": ["Ss", "Py", "Ow", "St"]},
    {"id": 15, "symbol": "St", "name": "Subtask", "family": "objects", "description": "Child unit of work under a Task.", "composesWith": ["Tk", "Ss"]},
    {"id": 16, "symbol": "Dc", "name": "Doc", "family": "objects", "description": "Document or structured content.", "composesWith": ["Fl", "Nt"]},
    {"id": 17, "symbol": "Fl", "name": "File", "family": "objects", "description": "Binary or unstructured file.", "composesWith": ["Dc"]},
    {"id": 18, "symbol": "Nt", "name": "Note", "family": "objects", "description": "Free-form annotation or comment.", "composesWith": ["Dc", "Ay"]},
    {"id": 19, "symbol": "Ev", "name": "Event", "family": "objects", "description": "Point-in-time occurrence.", "composesWith": ["Mt", "Ay"]},
    {"id": 20, "symbol": "Mt", "name": "Meeting", "family": "objects", "description": "Scheduled gathering.", "composesWith": ["Ev", "Ay"]},
    {"id": 21, "symbol": "In", "name": "Invoice", "family": "objects", "description": "Billing document.", "composesWith": ["Cu", "Ss", "Pm"]},
    {"id": 22, "symbol": "Pm", "name": "Payment", "family": "objects", "description": "Transfer of funds.", "composesWith": ["In", "Cu"]},
    {"id": 23, "symbol": "Su", "name": "Subscription", "family": "objects", "description": "Recurring entitlement.", "composesWith": ["Ac", "Pl", "Px"]},
    {"id": 24, "symbol": "Pl", "name": "Plan", "family": "objects", "description": "Pricing or feature tier.", "composesWith": ["Su", "Px"]},
    {"id": 25, "symbol": "Px", "name": "Price", "family": "objects", "description": "Monetary value of an offering.", "composesWith": ["Pr", "Cu"]},
    {"id": 26, "symbol": "Cp", "name": "Campaign", "family": "objects", "description": "Marketing or outreach campaign.", "composesWith": ["Ld", "Ms"]},
    {"id": 27, "symbol": "Ms", "name": "Message", "family": "objects", "description": "Communication unit.", "composesWith": ["Em", "No"]},
    {"id": 28, "symbol": "Em", "name": "Email", "family": "objects", "description": "Email message.", "composesWith": ["Ms", "Ct"]},
    {"id": 29, "symbol": "Cl", "name": "Call", "family": "objects", "description": "Voice or video call record.", "composesWith": ["Ay", "Ct"]},
    {"id": 30, "symbol": "Ay", "name": "Activity", "family": "objects", "description": "Logged action or interaction.", "composesWith": ["Ct", "Ev", "Tk"]},
    {"id": 31, "symbol": "Wf", "name": "Workflow", "family": "objects", "description": "Defined sequence of steps.", "composesWith": ["Tk", "Ti"]},
    {"id": 32, "symbol": "Tp", "name": "Template", "family": "objects", "description": "Reusable structure or content skeleton.", "composesWith": ["Dc", "Fm"]},
    {"id": 33, "symbol": "Tg", "name": "Tag", "family": "objects", "description": "Lightweight label.", "composesWith": ["Pr", "Tk"]},
    {"id": 34, "symbol": "Lc", "name": "Location", "family": "objects", "description": "Geographic or logical place.", "composesWith": ["Ad", "Mp"]},
    {"id": 35, "symbol": "Vn", "name": "Vendor", "family": "objects", "description": "External supplier or partner.", "composesWith": ["Co", "In"]},

    {"id": 36, "symbol": "Ss", "name": "Status", "family": "properties", "description": "Lifecycle or state value.", "composesWith": ["Tk", "In", "Us"]},
    {"id": 37, "symbol": "Bl", "name": "Boolean", "family": "properties", "description": "True/false flag.", "composesWith": ["Us", "Su", "Cp"]},
    {"id": 38, "symbol": "Dt", "name": "Date", "family": "properties", "description": "Calendar date.", "composesWith": ["Ev", "Mt"]},
    {"id": 39, "symbol": "Dm", "name": "DateTime", "family": "properties", "description": "Timestamp with time.", "composesWith": ["Ca", "Ua"]},
    {"id": 40, "symbol": "Nm", "name": "Number", "family": "properties", "description": "Numeric value.", "composesWith": ["Cn", "Pc"]},
    {"id": 41, "symbol": "Cu", "name": "Currency", "family": "properties", "description": "Monetary amount with unit.", "composesWith": ["In", "Pr", "Px"]},
    {"id": 42, "symbol": "Pc", "name": "Percent", "family": "properties", "description": "Percentage value.", "composesWith": ["Nm", "Sk"]},
    {"id": 43, "symbol": "Tx", "name": "Text", "family": "properties", "description": "Free-form string.", "composesWith": ["Dc", "Nt", "Cp"]},
    {"id": 44, "symbol": "Ur", "name": "URL", "family": "properties", "description": "Web address.", "composesWith": ["Co", "Dc", "Vn"]},
    {"id": 45, "symbol": "Ea", "name": "Email", "family": "properties", "description": "Email address field.", "composesWith": ["Ct", "Us"]},
    {"id": 46, "symbol": "Ph", "name": "Phone", "family": "properties", "description": "Telephone number.", "composesWith": ["Ct"]},
    {"id": 47, "symbol": "Ad", "name": "Address", "family": "properties", "description": "Physical or postal address.", "composesWith": ["Co", "Lc"]},
    {"id": 48, "symbol": "Js", "name": "JSON", "family": "properties", "description": "Structured JSON data.", "composesWith": ["Us", "Wf", "Cp"]},
    {"id": 49, "symbol": "En", "name": "Enum", "family": "properties", "description": "Constrained set of values.", "composesWith": ["Ss"]},
    {"id": 50, "symbol": "Id", "name": "ID", "family": "properties", "description": "Unique identifier.", "composesWith": ["Us", "Tk", "Co"]},
    {"id": 51, "symbol": "Ow", "name": "Owner", "family": "properties", "description": "Responsible user or entity.", "composesWith": ["Us", "Tk"]},
    {"id": 52, "symbol": "Ca", "name": "CreatedAt", "family": "properties", "description": "Creation timestamp.", "composesWith": ["Dm", "Ua"]},
    {"id": 53, "symbol": "Ua", "name": "UpdatedAt", "family": "properties", "description": "Last modification timestamp.", "composesWith": ["Dm", "Ca"]},
    {"id": 54, "symbol": "Sd", "name": "StartDate", "family": "properties", "description": "Begin timestamp or date.", "composesWith": ["Ed", "Pj"]},
    {"id": 55, "symbol": "Ed", "name": "EndDate", "family": "properties", "description": "End timestamp or date.", "composesWith": ["Sd", "Pj"]},
    {"id": 56, "symbol": "Py", "name": "Priority", "family": "properties", "description": "Relative importance ranking.", "composesWith": ["Tk", "Sk"]},
    {"id": 57, "symbol": "Sk", "name": "Score", "family": "properties", "description": "Numeric evaluation or ranking.", "composesWith": ["Py", "Nm"]},
    {"id": 58, "symbol": "Cn", "name": "Count", "family": "properties", "description": "Cardinality or quantity.", "composesWith": ["Nm"]},
    {"id": 59, "symbol": "Du", "name": "Duration", "family": "properties", "description": "Time span.", "composesWith": ["Dt", "Dm"]},